{
  "name": "Conformance: basic",
  "id": "dev.moesoft.conformance.basic",
  "version": "0.1.0",
  "engine": "^1.0.0",
  "entry": "ch1_intro",
  "sourceLanguage": "en",
  "languages": ["en"],
  "variables": {
    "player_name": { "type": "str", "default": "Aoi", "scope": "save" },
    "hana_affection": { "type": "int", "default": 0, "scope": "save" },
    "courage": { "type": "int", "default": 0, "scope": "save" },
    "heard_rumor": { "type": "bool", "default": false, "scope": "save" },
    "ending_true_seen": { "type": "bool", "default": false, "scope": "global" }
  }
}
